[
  {
    "status": "SUCCESS",
    "productInput": "206577650",
    "productId": "206577650",
    "storeSkuNumber": "1001619357",
    "productName": "Prep Series 1/2 HP Continuous Feed Garbage Disposal with Power Cord and Universal Mount",
    "modelNumber": "GXP50C",
    "productUrl": "https://www.homedepot.com/p/MOEN-Prep-Series-1-2-HP-Continuous-Feed-Garbage-Disposal-with-Power-Cord-and-Universal-Mount-GXP50C/206577650",
    "zipCodeRequested": "95050",
    "storeId": "0630",
    "storeName": "Santa Clara",
    "storeNameRaw": "Santa Clara",
    "storeAddress": "2435 Lafayette St, Santa Clara, CA, 95050",
    "distanceMiles": null,
    "price": 114,
    "originalPrice": null,
    "clearancePrice": null,
    "clearancePercentageOff": null,
    "bulkPrice": 102.6,
    "bulkQuantityRequired": 2,
    "stockQuantity": 19,
    "inStock": true,
    "limitedQuantity": false,
    "pickupAvailable": true,
    "curbsidePickupAvailable": true,
    "maxPickupQuantity": null,
    "availabilityType": "Shared",
    "reasonCode": null,
    "errorMessage": null,
    "checkedAt": "2026-09-20T15:58:14.606Z"
  },
  {
    "status": "SUCCESS",
    "productInput": "206577650",
    "productId": "206577650",
    "storeSkuNumber": "1001619357",
    "productName": "Prep Series 1/2 HP Continuous Feed Garbage Disposal with Power Cord and Universal Mount",
    "modelNumber": "GXP50C",
    "productUrl": "https://www.homedepot.com/p/MOEN-Prep-Series-1-2-HP-Continuous-Feed-Garbage-Disposal-with-Power-Cord-and-Universal-Mount-GXP50C/206577650",
    "zipCodeRequested": "95050",
    "storeId": "0642",
    "storeName": "Campbell",
    "storeNameRaw": "Campbell",
    "storeAddress": "480 E Hamilton Ave, Campbell, CA, 95008",
    "distanceMiles": null,
    "price": 114,
    "originalPrice": null,
    "clearancePrice": null,
    "clearancePercentageOff": null,
    "bulkPrice": 102.6,
    "bulkQuantityRequired": 2,
    "stockQuantity": 21,
    "inStock": true,
    "limitedQuantity": false,
    "pickupAvailable": true,
    "curbsidePickupAvailable": true,
    "maxPickupQuantity": null,
    "availabilityType": "Shared",
    "reasonCode": null,
    "errorMessage": null,
    "checkedAt": "2026-09-20T15:58:16.614Z"
  },
  {
    "status": "SUCCESS",
    "productInput": "206577650",
    "productId": "206577650",
    "storeSkuNumber": "1001619357",
    "productName": "Prep Series 1/2 HP Continuous Feed Garbage Disposal with Power Cord and Universal Mount",
    "modelNumber": "GXP50C",
    "productUrl": "https://www.homedepot.com/p/MOEN-Prep-Series-1-2-HP-Continuous-Feed-Garbage-Disposal-with-Power-Cord-and-Universal-Mount-GXP50C/206577650",
    "zipCodeRequested": "95050",
    "storeId": "0640",
    "storeName": "Kifer Rd",
    "storeNameRaw": "Kifer Rd",
    "storeAddress": "680 Kifer Rd, Sunnyvale, CA, 94086",
    "distanceMiles": null,
    "price": 114,
    "originalPrice": null,
    "clearancePrice": null,
    "clearancePercentageOff": null,
    "bulkPrice": 102.6,
    "bulkQuantityRequired": 2,
    "stockQuantity": 35,
    "inStock": true,
    "limitedQuantity": false,
    "pickupAvailable": true,
    "curbsidePickupAvailable": true,
    "maxPickupQuantity": null,
    "availabilityType": "Shared",
    "reasonCode": null,
    "errorMessage": null,
    "checkedAt": "2026-09-20T15:58:17.416Z"
  }
]
