{
  "status": "SUCCESS",
  "productInput": "206577650",
  "productId": "206577650",
  "storeSkuNumber": "1001619357",
  "productName": "Prep Series 1/2 HP Continuous Feed Garbage Disposal with Power Cord and Universal Mount",
  "modelNumber": "GXP50C",
  "productUrl": "https://www.homedepot.com/p/MOEN-Prep-Series-1-2-HP-Continuous-Feed-Garbage-Disposal-with-Power-Cord-and-Universal-Mount-GXP50C/206577650",
  "zipCodeRequested": "95050",
  "storeId": "0630",
  "storeName": "Santa Clara",
  "storeNameRaw": "Santa Clara",
  "storeAddress": "2435 Lafayette St, Santa Clara, CA, 95050",
  "distanceMiles": 1.0824222734465827,
  "price": 114,
  "originalPrice": null,
  "clearancePrice": null,
  "clearancePercentageOff": null,
  "bulkPrice": 102.6,
  "bulkQuantityRequired": 2,
  "stockQuantity": 14,
  "inStock": true,
  "limitedQuantity": false,
  "pickupAvailable": true,
  "curbsidePickupAvailable": true,
  "maxPickupQuantity": null,
  "availabilityType": "Shared",
  "reasonCode": null,
  "errorMessage": null,
  "checkedAt": "2026-07-28T14:35:43.782Z"
}
