[
  {
    "status": "SUCCESS",
    "productInput": "206577650",
    "productId": "206577650",
    "storeSkuNumber": "1001619357",
    "productName": "Prep Series 1/2 HP Continuous Feed Garbage Disposal with Power Cord and Universal Mount",
    "modelNumber": "GXP50C",
    "productUrl": "https://www.homedepot.com/p/MOEN-Prep-Series-1-2-HP-Continuous-Feed-Garbage-Disposal-with-Power-Cord-and-Universal-Mount-GXP50C/206577650",
    "zipCodeRequested": "10001",
    "storeId": "6175",
    "storeName": "Manhattan West 23rd St",
    "storeNameRaw": "Manhattan West 23rd St",
    "storeAddress": "40 West 23rd Street, New York, NY, 10010",
    "distanceMiles": null,
    "price": 114,
    "originalPrice": null,
    "clearancePrice": null,
    "clearancePercentageOff": null,
    "bulkPrice": 102.6,
    "bulkQuantityRequired": 2,
    "stockQuantity": 2,
    "inStock": true,
    "limitedQuantity": false,
    "pickupAvailable": true,
    "curbsidePickupAvailable": false,
    "maxPickupQuantity": null,
    "availabilityType": "Shared",
    "reasonCode": null,
    "errorMessage": null,
    "checkedAt": "2026-09-20T15:55:31.905Z"
  },
  {
    "status": "FAILED",
    "productInput": "205909852",
    "productId": "205909852",
    "storeSkuNumber": null,
    "productName": null,
    "modelNumber": null,
    "productUrl": "https://www.homedepot.com/p/205909852",
    "zipCodeRequested": "10001",
    "storeId": "6175",
    "storeName": "Manhattan West 23rd St",
    "storeNameRaw": "Manhattan West 23rd St",
    "storeAddress": "40 West 23rd Street, New York, NY, 10010",
    "distanceMiles": null,
    "price": null,
    "originalPrice": null,
    "clearancePrice": null,
    "clearancePercentageOff": null,
    "bulkPrice": null,
    "bulkQuantityRequired": null,
    "stockQuantity": null,
    "inStock": null,
    "limitedQuantity": null,
    "pickupAvailable": null,
    "curbsidePickupAvailable": null,
    "maxPickupQuantity": null,
    "availabilityType": null,
    "reasonCode": "NO_STORE_DATA",
    "errorMessage": "Home Depot returned no fulfillment data for product 205909852 at store 6175",
    "checkedAt": "2026-09-20T15:55:34.205Z"
  },
  {
    "status": "SUCCESS",
    "productInput": "206577650",
    "productId": "206577650",
    "storeSkuNumber": "1001619357",
    "productName": "Prep Series 1/2 HP Continuous Feed Garbage Disposal with Power Cord and Universal Mount",
    "modelNumber": "GXP50C",
    "productUrl": "https://www.homedepot.com/p/MOEN-Prep-Series-1-2-HP-Continuous-Feed-Garbage-Disposal-with-Power-Cord-and-Universal-Mount-GXP50C/206577650",
    "zipCodeRequested": "60601",
    "storeId": "1950",
    "storeName": "South Loop",
    "storeNameRaw": "South Loop",
    "storeAddress": "1300 S Clinton Street, Chicago, IL, 60607",
    "distanceMiles": null,
    "price": 114,
    "originalPrice": null,
    "clearancePrice": null,
    "clearancePercentageOff": null,
    "bulkPrice": 102.6,
    "bulkQuantityRequired": 2,
    "stockQuantity": 7,
    "inStock": true,
    "limitedQuantity": false,
    "pickupAvailable": true,
    "curbsidePickupAvailable": false,
    "maxPickupQuantity": null,
    "availabilityType": "Shared",
    "reasonCode": null,
    "errorMessage": null,
    "checkedAt": "2026-09-20T15:56:05.211Z"
  },
  {
    "status": "FAILED",
    "productInput": "205909852",
    "productId": "205909852",
    "storeSkuNumber": null,
    "productName": null,
    "modelNumber": null,
    "productUrl": "https://www.homedepot.com/p/205909852",
    "zipCodeRequested": "60601",
    "storeId": "1950",
    "storeName": "South Loop",
    "storeNameRaw": "South Loop",
    "storeAddress": "1300 S Clinton Street, Chicago, IL, 60607",
    "distanceMiles": null,
    "price": null,
    "originalPrice": null,
    "clearancePrice": null,
    "clearancePercentageOff": null,
    "bulkPrice": null,
    "bulkQuantityRequired": null,
    "stockQuantity": null,
    "inStock": null,
    "limitedQuantity": null,
    "pickupAvailable": null,
    "curbsidePickupAvailable": null,
    "maxPickupQuantity": null,
    "availabilityType": null,
    "reasonCode": "NO_STORE_DATA",
    "errorMessage": "Home Depot returned no fulfillment data for product 205909852 at store 1950",
    "checkedAt": "2026-09-20T15:56:10.005Z"
  }
]
